{
  "created_at": "2026-07-20T11:15:00Z",
  "evidence": [],
  "extensions": {},
  "kind": "user_conclusion",
  "memory_id": "mem-20260720-sampling-conclusion",
  "observation_ids": ["obs-20260718-frog-calls"],
  "schema_version": "1.0.0",
  "statement": "The available recording establishes activity during the sampled evening, not population size.",
  "status": "active",
  "supersedes": null,
  "title": "Sampling conclusion",
  "updated_at": "2026-07-20T11:15:00Z"
}
