{
  "created_at": "2026-07-20T11:05:00Z",
  "evidence": [],
  "extensions": {},
  "kind": "open_question",
  "memory_id": "mem-20260720-seasonal-comparison",
  "observation_ids": ["obs-20260718-frog-calls"],
  "schema_version": "1.0.0",
  "statement": "Does detected activity persist across seasons?",
  "status": "active",
  "supersedes": null,
  "title": "Seasonal comparison",
  "updated_at": "2026-07-20T11:05:00Z"
}
